{
  "id": "arkavo/ws/ws-send-message",
  "title": "Unary SendMessage over the WS envelope (req→res). DRAFT STUB — activates when the arkavo adapters land; expectations follow the spec's conformance section.",
  "spec": "specs/arkavo/ws-binding-v1.md §3",
  "client": {
    "op": "SendMessage",
    "params": {
      "message": {
        "messageId": "m-1",
        "role": "ROLE_USER",
        "parts": [
          {
            "text": "over websocket"
          }
        ]
      }
    }
  },
  "server": {
    "respond": {
      "task": {
        "id": "t-ws-1",
        "contextId": "c-1",
        "status": {
          "state": "TASK_STATE_COMPLETED"
        }
      }
    }
  },
  "expect": {
    "kind": "result",
    "checks": [
      {
        "path": "$.task.id",
        "equals": "t-ws-1"
      }
    ]
  },
  "tags": [
    "arkavo",
    "ws",
    "stub"
  ],
  "appliesTo": {
    "clients": [
      "arkavo-ext-rust",
      "arkavo-ext-swift"
    ],
    "servers": [
      "arkavo-ext-rust",
      "arkavo-ext-swift"
    ]
  }
}
