{
  "id": "arkavo/transport-equivalence/streaming-equivalent",
  "title": "Same streaming exchange over SSE ≡ WS envelope: identical event sequence. DRAFT STUB — activates when the arkavo adapters land; expectations follow the spec's conformance section.",
  "spec": "specs/arkavo/framing-envelope-v1.md §7",
  "client": {
    "op": "SendStreamingMessage",
    "params": {
      "message": {
        "messageId": "m-1",
        "role": "ROLE_USER",
        "parts": [
          {
            "text": "stream equivalence"
          }
        ]
      }
    }
  },
  "server": {
    "sse": [
      {
        "task": {
          "id": "t-eq-2",
          "contextId": "c-1",
          "status": {
            "state": "TASK_STATE_WORKING"
          }
        }
      },
      {
        "statusUpdate": {
          "taskId": "t-eq-2",
          "contextId": "c-1",
          "status": {
            "state": "TASK_STATE_COMPLETED"
          }
        }
      }
    ]
  },
  "expect": {
    "kind": "stream",
    "streamOrder": [
      "task",
      "statusUpdate"
    ]
  },
  "tags": [
    "arkavo",
    "transport-equivalence",
    "stub"
  ],
  "appliesTo": {
    "clients": [
      "arkavo-ext-rust",
      "arkavo-ext-swift"
    ],
    "servers": [
      "arkavo-ext-rust",
      "arkavo-ext-swift"
    ]
  }
}
