{
  "id": "arkavo/tdf/nanotdf-part-roundtrip",
  "title": "Inline NanoTDF data part encrypts on send and decrypts on receipt: the receiver decrypts the shape-(a) part to the byte-identical known plaintext and reads the sibling plaintext part normally (tdf-parts-v1 §2, §7).",
  "spec": "specs/arkavo/tdf-parts-v1.md",
  "client": {
    "op": "SendMessage",
    "params": {
      "message": {
        "messageId": "m-1",
        "role": "ROLE_USER",
        "parts": [
          {
            "text": "encrypt my payload"
          }
        ]
      }
    }
  },
  "server": {
    "respond": {
      "task": {
        "id": "t-tdf-1",
        "contextId": "c-1",
        "status": {
          "state": "TASK_STATE_COMPLETED"
        }
      }
    }
  },
  "expect": {
    "kind": "result",
    "checks": [
      {
        "path": "$.task.id",
        "equals": "t-tdf-1"
      },
      {
        "path": "$.tdf.scheme",
        "equals": "nanotdf"
      },
      {
        "path": "$.tdf.plaintext",
        "equals": "hello tdf"
      },
      {
        "path": "$.tdf.sibling",
        "equals": "sibling plaintext"
      }
    ]
  },
  "tags": [
    "arkavo",
    "tdf"
  ],
  "appliesTo": {
    "clients": [
      "arkavo-ext-rust",
      "arkavo-ext-swift"
    ],
    "servers": [
      "arkavo-ext-rust",
      "arkavo-ext-swift"
    ]
  }
}
